{
  "schema_version": 1,
  "release_id": "rel-19e39bf959da-f412ba55",
  "candidate_sha": "19e39bf959da5e8c340c280868a6c7d946876472",
  "base_sha": "39373c657589f46673c2563c03879b7201e8bd30",
  "policy_sha": "64eb459035d29db8fea0c9c30e556dad8e50825756a949ac7a659142a327efac",
  "tree_sha": "01e5d633a7702b5d02b1cbe0fbccd861632efc9f",
  "domains": [
    "Platform/DB/Edge"
  ],
  "capabilities": [
    "release_policy"
  ],
  "risk_floor": "HOTFIX",
  "urgency": "normal",
  "decision": "CLASSIFIED",
  "reasons": [],
  "affected_edge_functions": [],
  "edge_manifest": {},
  "invariants": {
    "release.identity_exact": {
      "status": "passed",
      "exit_code": 0,
      "log_sha256": "6b9bd92926ba9579eaa31551af94b2c452aea46a763598523abb29ada323c027",
      "at": "2026-10-01T14:29:24.714Z"
    },
    "release.stage_identity_exact": {
      "status": "blocked",
      "reason": "isolated Stage target unavailable"
    }
  },
  "stage": null,
  "intended_production": {
    "vercel": "UNKNOWN",
    "supabase": "UNKNOWN",
    "migrations": "manual-review"
  },
  "recovery_reference": null,
  "evidence": {},
  "status": "BLOCKED",
  "blockers": [
    "release.stage_identity_exact: blocked (isolated Stage target unavailable)"
  ],
  "created_at": "2026-10-01T14:29:16.222Z",
  "updated_at": "2026-10-01T14:29:24.775Z",
  "events": [
    {
      "event": "INSPECTED",
      "key": "19e39bf959da5e8c340c280868a6c7d946876472",
      "at": "2026-10-01T14:29:16.229Z"
    },
    {
      "event": "BLOCKED",
      "key": "stage-target",
      "at": "2026-10-01T14:29:16.849Z",
      "reason": "isolated Stage target unavailable"
    },
    {
      "event": "EVIDENCE",
      "key": "release.identity_exact",
      "at": "2026-10-01T14:29:24.715Z",
      "invariant": "release.identity_exact",
      "status": "passed",
      "digest": "6b9bd92926ba9579eaa31551af94b2c452aea46a763598523abb29ada323c027"
    },
    {
      "event": "VERIFIED",
      "key": "9925a4e2a661a3152fb9199bc233e0716033855970eaf1651285c8f62ad61d86",
      "at": "2026-10-01T14:29:24.775Z",
      "status": "BLOCKED"
    }
  ]
}
