{
  "schema_version": 1,
  "release_id": "rel-b706200a6a72-f412ba55",
  "candidate_sha": "b706200a6a720daf6135cd49ca3ff5b6fff006c7",
  "base_sha": "39373c657589f46673c2563c03879b7201e8bd30",
  "policy_sha": "64eb459035d29db8fea0c9c30e556dad8e50825756a949ac7a659142a327efac",
  "tree_sha": "bb7057ebc592b5470d46c8250101dbed3550619c",
  "domains": [
    "Platform/DB/Edge"
  ],
  "capabilities": [
    "release_policy"
  ],
  "risk_floor": "HOTFIX",
  "urgency": "normal",
  "decision": "CLASSIFIED",
  "reasons": [],
  "affected_edge_functions": [],
  "edge_manifest": {},
  "invariants": {
    "release.identity_exact": {
      "status": "passed",
      "exit_code": 0,
      "log_sha256": "2e2b508e48cade0b4763fc3d7d98e5582749be5cae216b8fcdd23e8c03687a38",
      "at": "2026-10-01T13:45:56.404Z"
    },
    "release.stage_identity_exact": {
      "status": "blocked",
      "reason": "isolated Stage target unavailable"
    }
  },
  "stage": null,
  "intended_production": {
    "vercel": "UNKNOWN",
    "supabase": "UNKNOWN",
    "migrations": "manual-review"
  },
  "recovery_reference": null,
  "evidence": {},
  "status": "BLOCKED",
  "blockers": [
    "release.stage_identity_exact: blocked (isolated Stage target unavailable)"
  ],
  "created_at": "2026-10-01T13:45:37.437Z",
  "updated_at": "2026-10-01T13:45:56.462Z",
  "events": [
    {
      "event": "INSPECTED",
      "key": "b706200a6a720daf6135cd49ca3ff5b6fff006c7",
      "at": "2026-10-01T13:45:37.438Z"
    },
    {
      "event": "BLOCKED",
      "key": "stage-target",
      "at": "2026-10-01T13:45:49.106Z",
      "reason": "isolated Stage target unavailable"
    },
    {
      "event": "EVIDENCE",
      "key": "release.identity_exact",
      "at": "2026-10-01T13:45:56.405Z",
      "invariant": "release.identity_exact",
      "status": "passed",
      "digest": "2e2b508e48cade0b4763fc3d7d98e5582749be5cae216b8fcdd23e8c03687a38"
    },
    {
      "event": "VERIFIED",
      "key": "cfa284a59b3549502309d4f4d9253e60afb4e6a3410b2ec9750f012ad9552d92",
      "at": "2026-10-01T13:45:56.462Z",
      "status": "BLOCKED"
    }
  ]
}
